{
  "schema_version": "service-decision-dsl.node-invocation.v2",
  "example_only": true,
  "executor": "execute_action",
  "node_ref": {
    "workflow_id": "demo.solve",
    "phase_id": "P3",
    "step_id": "P3.S1",
    "node_id": "A_ASK"
  },
  "definition_digest": "1e65ec3becb62b4eca18a39bd67373a1c5b065452195cf649ed1633a93782730",
  "inputs": {
    "action_intent": {
      "intent_id": "ask_meeting",
      "kind": "INTERACTION",
      "target_node_id": "A_ASK",
      "parameters": {
        "question_ref": "demo.ask_meeting@1",
        "order_id": "O-100"
      }
    },
    "bound_parameters": {
      "question_ref": "demo.ask_meeting@1",
      "order_id": "O-100"
    }
  },
  "execution_context": {
    "workflow_run_id": "EXAMPLE-WR-001",
    "step_run_id": "EXAMPLE-SR-P3-001",
    "attempt_id": "EXAMPLE-ATTEMPT-1",
    "node_run_id": "EXAMPLE-NR-A_ASK",
    "activation_ref": "synthetic:activation-A_ASK",
    "subject_scope_ref": "synthetic:tenant-demo:order-O-100",
    "authorization_context_ref": "synthetic:read-and-interact-only",
    "as_of": "2026-10-01T00:00:00Z",
    "evaluation_ref": "synthetic:evaluation-D1"
  }
}
