{
  "schema_version": "service-decision-dsl.node-invocation.v2",
  "example_only": true,
  "executor": "evaluate_decision",
  "node_ref": {
    "workflow_id": "demo.solve",
    "phase_id": "P3",
    "step_id": "P3.S1",
    "node_id": "D1"
  },
  "definition_digest": "1e65ec3becb62b4eca18a39bd67373a1c5b065452195cf649ed1633a93782730",
  "inputs": {
    "parameter_snapshot": {
      "example_only": true,
      "parameters": {
        "order_id": {
          "quality": "KNOWN",
          "value": "O-100",
          "source_refs": [
            "Q_CONTEXT"
          ]
        },
        "met_driver": {
          "quality": "UNKNOWN",
          "value": null,
          "source_refs": [
            "demo.user_event"
          ]
        },
        "other_information_complete": {
          "quality": "KNOWN",
          "value": true,
          "source_refs": [
            "Q_HISTORY:fixture"
          ]
        }
      },
      "as_of": "2026-10-01T00:00:00Z",
      "schema_version": "service-decision-dsl.parameter-snapshot.v2",
      "prepared_for": {
        "workflow_id": "demo.solve",
        "phase_id": "P3",
        "step_id": "P3.S1",
        "node_id": "D1"
      },
      "definition_digest": "1e65ec3becb62b4eca18a39bd67373a1c5b065452195cf649ed1633a93782730",
      "subject_scope_ref": "synthetic:tenant-demo:order-O-100",
      "provenance": {
        "environment": "SYNTHETIC",
        "fixture_only": true,
        "scope_note": "No authenticated source or production readiness claim"
      }
    },
    "runtime_snapshot": {
      "step_status": "RUNNING",
      "receipt_refs": []
    }
  },
  "execution_context": {
    "workflow_run_id": "EXAMPLE-WR-001",
    "step_run_id": "EXAMPLE-SR-P3-001",
    "attempt_id": "EXAMPLE-ATTEMPT-1",
    "node_run_id": "EXAMPLE-NR-D1",
    "activation_ref": "synthetic:activation-D1",
    "subject_scope_ref": "synthetic:tenant-demo:order-O-100",
    "authorization_context_ref": "synthetic:read-and-interact-only",
    "as_of": "2026-10-01T00:00:00Z"
  }
}
